,address,company,conditions,date,description,duty,experience,name,requirements,salaryMAX,salaryMIN,schedule,skills,type_of_employment,url,count_day
544,Челябинск,Шуховцев Дмитрий Алексеевич,"Работа с интересным продуктом,Благоприятный климат для профессионального и личностного роста, дружная молодая команда;,Оформление по ТК РФ;,Заработная плата: (оклад 20 000 руб. + бонус) в совокупности, при достижении плана от 30 000 руб. и выше;,График работы 5/2 с 09:00 до 18:00 по Московскому времени. т.к. большей частью мы работаем с клиентами г. Москвы и Московской области.,Мы ищем менеджера с опытом и желанием зарабатывать!",14 октября 2020," Группа компаний «MAXARD» успешно предоставляет своим клиентам высокое качество консалтинговых услуг с 2012 года. Мы перешли полностью на удаленную работу. Онлайн компания - работающая на удаленной основе с 2020 года! Мы гарантируем качество нашей работы! Учредитель ГК «MAXARD» Звиади Пурцхванидзе. История успеха работы компании заключается в том, что у нас сплочённая команда профессионалов и отличные взаимоотношения с клиентами. Наша компания, обеспечивает своим клиентам высокий уровень оказания консалтинговых услуг: Налоговый консалтинг; Земельные правоотношения; Оспаривание кадастровой стоимости. Требования: Готовность принимать входящие звонки Готовность работать с холодной базой, при этом не испытывать дискомфорт в работе; Выполнять планы по звонкам; Выполнение плана по согласованию встреч; Желание работать и зарабатывать - нам не интересен человек, готовый удовлетвориться окладом; Знание этапов техники продаж, знание способов выхода на ЛПР; Опыт работы в продажах от 2х лет (опыт в продаже юридических услуг будет преимуществом) Задачи: - формирование клиентской базы, холодный обзвон; - выход на лицо принимающее решение; - консультирование потенциальных клиентов по направлениям (ОКС, консалтинг земельных правоотношений, консалтинг налогового права) сопутствующих услуг; - консультирование потенциальных клиентов по вопросам юридического абонентского обслуживания (полное юридическое сопровождение юридических лиц); - Первичная консультация клиента, запрос документов по услуге, формирование ТЗ, направление на предварительную оценку (юристу/оценщику) - Разбор клиентов проработанных (оценщиком/юристом) с руководителем ОП - передача потенциальных клиентов коллегам в Московский офис, для дальнейшей встречи и заключения договора; - выполнение плана звонков; - выполнение плана назначенных встреч; - ведение базы клиентов в CRM. Условия: Работа с интересным продуктом Благоприятный климат для профессионального и личностного роста, дружная молодая команда; Оформление по ТК РФ; Заработная плата: (оклад 20 000 руб. + бонус) в совокупности, при достижении плана от 30 000 руб. и выше; График работы 5/2 с 09:00 до 18:00 по Московскому времени. т.к. большей частью мы работаем с клиентами г. Москвы и Московской области. Мы ищем менеджера с опытом и желанием зарабатывать! Работа на удаленной основе! 15 принципов видения бизнеса собственника компании - Звиади Пурцхванидзе: <ol> Будь честным, будь смелым Никогда не теряй деньги Успешные люди думают только о будущем, анализируя прошлое Занимайтесь исключительно своим любимым делом и деньги обязательно придут Скорость + Фокус = Результат Находить самую лучшую бизнес модель в ГК MAXARD. (Масштабируй в мир) Профессионалы все считают в бизнесе Культурно требовать высоких результатов от команды Менеджмент без контроля – не менеджмент Маркетинг на мировом уровне: имидж, позиционирование, миссия. Стратегия. Цель бизнеса, анализ – система в ГК MAXARD Ответственность – основа всех основ Самый главный показатель в бизнесе – это рентабельность капитала (мы капиталисты)! Расти вместе с командой Не спрашивай что может сделать для тебя ГК MAXARD, спроси что ТЫ можешь сделать для ГК MAXARD Дух соперничества: нам надо быть впереди! Нам дышат в спину – расслабляться нельзя. Мы должны быть преданы делу и верить, что завтра будет лучше! </ol> ",не указано,3–6 лет,Менеджер по работе с клиентами/Менеджер по продажам,"Готовность принимать входящие звонки,Готовность работать с холодной базой, при этом не испытывать дискомфорт в работе;,Выполнять планы по звонкам;,Выполнение плана по согласованию встреч;,Желание работать и зарабатывать - нам не интересен человек, готовый удовлетвориться окладом;,Знание этапов техники продаж, знание способов выхода на ЛПР;,Опыт работы в продажах от 2х лет (опыт в продаже юридических услуг будет преимуществом)",86130.4,20000.0,полный день,"CRM,Холодные продажи,Активные продажи,Холодные звонки,Консультирование,Навыки работы с возражениями,Юридический консалтинг,телефонные продажи,Ведение клиентской базы,Оценка потребностей клиентов,Консультирование клиентов",Полная занятость,https://tyumen.hh.ru/vacancy/39804576,15
551,Челябинск,Гринатом,не указаны,8 октября 2020," Обязанности: Работа с действующими и потенциальными клиентами, активные продажи услуг и сервисов компании.; Поиск и привлечение клиентов в секторах ОПК, энергетике, атомной, нефтегазовой отраслях, гос. компаниях, гос. секторе; Контроль разработки и утверждения технико-коммерческих предложений; Сопровождение клиента на всех стадиях реализации проекта; Постоянное изучение отраслевой специфики деятельности клиентов, нахождение новых областей применения решений и услуг Компании. Требования: Опыт работы в сфере продаж проектов системной интеграции, продажи ПО и ИТ оборудования, опыт продаж СЭД, ERP, МES-систем; Опыт успешных коммерческих переговоров на уровне первых лиц; Понимание процесса реализации проектов в государственных компаниях, гос. секторе; Понимание принципов формирования и распределения бюджета закупок потенциальных клиентов; Понимание методологии управления проектами; Способность структурировано подходить к выявлению проблем заказчика и их решению Желание расти личностно и профессионально Условия: Официальное оформление по ТК РФ, следовательно, стабильную заработную плату с выплатами 2 раза в месяц + годовой бонус по итогам работы; Подключение к программе ДМС (включая стоматологию), полный соц.пакет, оплата больничных листов; 5-ти дневная рабочая неделя с сокращенной пятницей; Возможность карьерного и профессионального роста; Корпоративные мероприятия и другие активности. ",не указано,1–3 года,Менеджер по работе с ключевыми клиентами,,86130.4,34727.3,полный день,"Активные продажи,Навыки переговоров,Деловое общение,Ориентация на результат,Корпоративные продажи,Формирование бюджета,B2B Продажи",Полная занятость,https://tyumen.hh.ru/vacancy/39696349,21
554,Челябинск,Партнёрпромснаб,не указаны,14 октября 2020," Обязанности: Выполнение плана по объемам продаж, развитие вверенной территории. Работа с текущей клиентской базой и поиск новых клиентов. Составление коммерческих предложений и заключение договоров. Создание и поддержание доброжелательных отношений с клиентами. Требования: Опыт продаж приветствуется. Уверенный пользователь ПК;( Word; Excel) Ответственность, трудолюбие, коммуникабельность, стрессоустойчивость; Умение грамотно вести переговоры с клиентами; Умение убеждать и работать на результат; Активный поиск и привлечение новых клиентов; Выявление потребностей заказчиков; Сопровождение клиента на всех этапах сделки. Поиск новых клиентов Обработка входящих звонков Поддерживать отношение с постоянными клиентами Заключать договора Обучаться Готовность и желание работать и зарабатывать Знание CRM приветствуется Комфортное рабочее место на Северо-западе Обучение и консультация тех. специалистов. Условия: - Оформление по ТК РФ; - График работы: полный рабочий день 9.00-17.00;( С перерывом на обед в один час.) - Современный офис со всем необходимым оборудованием; - Заработная плата (оклад + % от продаж); - Работа в перспективной развивающейся компании. - Чай, кофе, плюшки за счёт компании. Если ты: Активный и целеустремленный Умеешь продавать или хочешь этому научиться Трудолюбивый и ответственный Организован Инициативный и креативный Нацелен на результат Еще и эмоциональный, позитивный, умеющий располагать к себе людей и убеждать. То, мы будем рады предложить тебе: Активную клиентскую базу Уникальный продукт Трудоустройство Оборудованное рабочее место Личностный и карьерный рост Интересную и увлекательную работу Надежный фиксированный оклад + % от продаж + оплату связи Единоразовые поощрения за выполнение сверх поставленных задач ",не указано,не требуется,Региональный менеджер по продажам,,86130.4,34727.3,полный день,"Активные продажи,Поиск и привлечение клиентов,Холодные продажи,CRM,Прямые продажи,Деловое общение,Документальное сопровождение,Обучение и развитие,Клиентоориентированность,Холодные звонки,Ведение переговоров,Пользователь ПК,Развитие продаж,Заключение договоров,работа с текущей базой клиентов,Телефонные переговоры,Навыки переговоров,Работа с возражениями,Грамотность,Работа с большим объемом информации,Сопровождение клиентов",Полная занятость,https://tyumen.hh.ru/vacancy/39513398,15
560,Челябинск,Рубикон Инфо,не указаны,25 сентября 2020," Обязанности: Поиск новых партнеров Ведение текущих партнеров Проведение переговоров Оформление заказов Выписка закрывающих документов Контроль дебиторской задолженности Требования: Наличие опыта продаж с сфере ИТ. Наличие собственной базы партнеров. Условия: Официальное трудоустройство Своевременная оплата труда График работы с 10-18, сб и вс. выходные дни ",не указано,1–3 года,Ведущий менеджер по продажам,,500000.0,20000.0,полный день,"Работа с дебиторской задолженностью,работа с текущей базой клиентов,Ведение переговоров,Пользователь ПК,Контроль дебиторской задолженности,Умение работать в команде",Полная занятость,https://tyumen.hh.ru/vacancy/39461124,34
564,Челябинск,Север Телеком,не указаны,12 октября 2020," Обязанности: поиск и привлечение потенциальных Клиентов; регулярные переговоры; выявление потребностей,согласование условий сотрудничества с Клиентами; заключение договора на услуги связи и отслеживание его надлежащее исполнение; ежедневное планирование графика звонков и встреч с потенциальными Клиентами; отчетность. Требования: желание зарабатывать; навыки продаж и эффективных коммуникаций; потребность добиваться результата и взаимовыгодных условий; знание рынка конкурентов приветствуется; уверенное пользование ПК (Word, Excel). Условия: работа в крупной федеральной телекоммуникационной Компании; официальное оформление согласно ТК РФ; график работы стандартная 5/2 , с 09.00 до 18.00; работа в комфортабельном офисе в центре города; достойный уровень дохода, зарплата, состоящая из фикс.оклада + % от продаж без ""потолка"" + премии + бонусов; профессиональное развитие и карьерный рост; бесплатное корпоративное обучение; компенсация ГСМ и мобильной связи ",не указано,не требуется,Менеджер по работе с корпоративными клиентами,,60000.0,40000.0,полный день,"Поиск и привлечение клиентов,Активные продажи,Холодные продажи,Планирование продаж,Развитие продаж",Полная занятость,https://tyumen.hh.ru/vacancy/39153665,17
596,Челябинск,ГК Диамант,не указаны,12 октября 2020," Наша сплоченная команда в поиске специалиста на должность ""SMM-менеджер""! Мы ищем энергичных людей, с большим желанием работать и развиваться в сфере гостеприимства! Обращаем ваше внимание, что требуется специалист в г.Челябинск (НЕ УДАЛЕННО!) ОБЯЗАННОСТИ : Участие в разработке и настройка эффективных рекламных кампаний в Интернете. Настройка и оптимизация рекламных кампаний в соц.сетях (Вконтакте, Instagram). Участие в разработке SMM стратегии; планирование бюджета. Создание и размещение качественного контента. Работа с внешними подрядчиками по своему функционалу (таргетологи, блогеры и т.д.). Мониторинг конкурентного рынка и тенденций современного интернет-маркетинга. Аналитика и оптимизация затрат на интернет-маркетинг. Работа с отзывами. Создание фотоконтента (съемка). ТРЕБОВАНИЯ : Опыт работы на аналогичной должности. Опыт написания статей, постов, создание и редактирования фото, навыки видеомонтажа. Знания и понимание основ SMM-маркетинга. Интерес к трендам в области интернет-маркетинга. Наличие реализованных кейсов будет вашим преимуществом! Аналитический склад ума, системный подход. Многозадачность, самоорганизация, ориентация на результат. УСЛОВИЯ : Возможность самореализации и профессионального роста; маркетинговый опыт в ресторанной сфере; интересные проекты и задачи. Официальное трудоустройство согласно ТК РФ. Достойный уровень оплаты труда и своевременные выплаты. Комфортное рабочее место в Центре города. График работы: пятидневная рабочая неделя. Команда молодых, увлеченных, позитивных и амбициозных профессионалов! Заработная плата обсуждается с успешным кандидатом, в зависимости от профессиональных компетенций! Мы будем рады вашему отклику!!! ​По любым вопросам, Вы можете связаться с менеджером по персоналу, используя приложения Viber / WhatsApp. ",не указано,1–3 года,SMM-менеджер,,86130.4,34727.3,полный день,"Интернет-реклама,Маркетинговый анализ,Internet Marketing,Adobe Photoshop,Маркетинговые исследования,SMM,Таргетинг,Ведение групп в социальных сетях,Социальные сети,Наполнение контентом,Продвижение сайтов,SMS маркетинг",Полная занятость,https://tyumen.hh.ru/vacancy/39244927,17
