,address,company,conditions,date,description,duty,experience,name,requirements,salaryMAX,salaryMIN,schedule,skills,type_of_employment,url,count_day
149,Чебаркуль,Бигранта,не указаны,30 сентября 2020," Компания ""Бигранта"" усиливает команду и ищет активных и ответственных кандидатов на должность менеджера по продажам на удалённой основе. Обязанности: • Проведение переговоров с регулярными и потенциальными клиентами; • Подготовка коммерческих предложений; • Сопровождение клиента (от момента переговоров до контроля оплаты, документации, дебиторской задолженности) Требования: Компания «Бигранта» будет рада видеть в своей команде как профессионалов в сфере корпоративных продаж на рынке В2В, так и новичков, которые имеют огромное желание развиваться в данном направлении! • Навыки ведения телефонных переговоров; • Нацеленность на результат, самостоятельность; • Грамотная речь, четкая дикция; • Высокая обучаемость; • Умение работать в команде; • Опыт в сфере продаж В2В, работы с корпоративными клиентами будет являться вашим преимуществом. НАЛИЧИЕ рабочей техники: ноутбук/компьютер+ гарнитура Условия: Работа возможна УДАЛЕННО; • Оплата сдельная (оклад+%+премия). Средняя ЗП в отделе 35.000-40.000; • Корпоративное обучение, тренинги, конкурсы. Очные тренинги от нашего бизнес-тренера в главном офисе г. Челябинска с предоставлением проживания на это время; • Перспектива профессионального и личностного роста; • Дружный, активный и целеустремленный коллектив; • Карьерный рост при положительной динамике результатов; • График 5/2, с 08:30 до 17:15 (по Челябинскому времени) ",не указано,не требуется,Менеджер по продажам (удаленная работа),,,,удаленная работа,"Телефонные переговоры,Поиск и привлечение клиентов,Холодные продажи,Навыки продаж,Сопровождение клиентов,B2B Продажи,Работа в команде",Полная занятость,https://tyumen.hh.ru/vacancy/39539490,29
154,Челябинск,Факт,не указаны,1 октября 2020," Факт - лидер рынка веб-интеграторов. Надежный веб-интегратор Факт - работаем с крупнейшими российскими федеральными компаниями и представительствами крупных зарубежных компаний в России. Наши заказчики - такие известные бренды, как ПАО ""Туполев"", Технониколь, Русал, Гознак, Адамас, Paolo Conte, Gold 585, Интер РАО ЕЭС и другие. Профиль нашей компании - создание, сопровождение и развитие технологичных веб-систем. В связи с расширением проектных работ , мы ищем Менеджера IT-проектов / Project Manager с хорошим практическим опытом работы в сфере IT в Челябинске Старт карьеры. Сотруднику назначаем наставника, проводим адаптацию и принимаем экзамены. Рост в компании. Сотрудники вырастают в профессиональном, карьерном, финансовом уровне. Жизнь внутри. У нас есть настольный теннис, шахматные турниры, покорение горных вершин Урала, велоквесты, Cheese quiz. Каждый месяц мы проводим whiskey-break. Бонусы сотрудникам. Кофе-машина, вкусный чай, корпоративная библиотека, бесплатное обучение английскому языку на рабочем месте. Что делать: Поддержка и развитие крупных проектов Согласование с заказчиками объема работ, постановка задач исполнителям и контроль эффективности их исполнения Управление и планирование рабочими ресурсами; Ведение проектной документации и отчетности. Требования: Грамотный устный и письменный русский язык; Внимательность и способность самостоятельно разбираться в предметной области, находить и принимать решения; Отличные коммуникационные навыки; Умение задавать рабочий темп и мотивировать команду; Многозадачность и стрессоустойчивость; Умение при необходимости решать конфликтные ситуации с клиентом (в идеале умение сделать всё, чтобы конфликтной ситуации не возникло). Желательно: Опыт работы с IT-проектами; Опыт взаимодействия с программистами; Понимание технологий и принципов разработки и запуска интернет-проектов; Ваше стремление обучаться и развиваться в одной из лучших команд России. Что вас ждет: Высокая заработная плата + KPI, официальное трудоустройство, социальные гарантии по ТК РФ Соцпакет Прозрачная система профессионального, карьерного, финансового роста Бесплатное обучение английскому языку на рабочем месте Возможность реализовывать крупные, высоконагруженные web-проекты в большой команде Работа с использованием новейших программных продуктов и технологий Дружная команда профессионалов в четырех офисах по стране. Окончательный уровень заработной платы устанавливается по результатам собеседования в зависимости от опыта и квалификации. ",не указано,1–3 года,Менеджер IT-проектов / Project Manager," , , , , , , , , , , , ",86130.4,40000.0,полный день,"Управление интернет-проектами,Управление проектами,Ведение переговоров,Ведение активных клиентов,Деловая переписка,Деловая коммуникация,Навыки презентации,Работа в команде",Полная занятость,https://tyumen.hh.ru/vacancy/39559907,28
155,Челябинск,СПАР Урал,"Место работу ул. Труда, д. 166.,График работу пятидневная рабочая неделя с 09.00 до 18.00.,Заработная плата: оклад до 30000 руб.,Официальное трудоустройство с полным социальным пакетом.",9 октября 2020," Обязанности: Изменение розничных цен и торговых наценок на товары в учетной системе. Прогрузка в учетную систему ценовых акций, скидок. Формирование переоценок, проверка автоматически формируемых переоценок, расчет акционных цен. Составление отчетов по ценообразованию и ценовому моделированию (в том числе по данным БД MS SQL). Создание и поддержка заданий в базе данных (MS SQL) по проверке розничных цен и других показателей, касающихся розничного ценообразования, рассылкам по вопросам, касающихся розничных цен. Требования: 1. Профессиональное владение EXCEL (функции, сводные таблицы). 2. Знание основ розничного ценообразования (порядок расчета розничной цены, торговой наценки, продаж, прибыли). 3. Знание SQL будет является преимуществом. 4. Умение работать с большими объемами данных, аналитический склад ума. 5. Аккуратность, внимательность, ответственность. Условия: Место работу ул. Труда, д. 166. График работу пятидневная рабочая неделя с 09.00 до 18.00. Заработная плата: оклад до 30000 руб. Официальное трудоустройство с полным социальным пакетом. По вакансии следует обращаться в Отдел подбора персонала: г. Челябинск, ул. Труда, д. 166, 1 этаж, каб. ""Отдел подбора персонала"" в будние дни с 09.00 до 17.00. Уважаемые кандидаты! При отправке резюме в теме письма обязательно укажите вакансию. После получения резюме мы связываемся с Вами самостоятельно в случае положительного рассмотрения. Если у Вас возникли вопросы по вакансиям, то Вы можете позвонить по указанным в объявлении телефонам. ",не указано,не требуется,Менеджер по ценообразованию,"Место работу ул. Труда, д. 166.,График работу пятидневная рабочая неделя с 09.00 до 18.00.,Заработная плата: оклад до 30000 руб.,Официальное трудоустройство с полным социальным пакетом.",86130.4,30000.0,полный день,"Ценообразование,MS SQL,Работа с базами данных,Internet,Работа с оргтехникой",Полная занятость,https://tyumen.hh.ru/vacancy/39731067,20
170,Челябинск,Рыббла,не указаны,7 октября 2020," В связи с расширением компания « Рыббла » объявляет конкурс на вакансию «Менеджер по продажам сайтов, интернет-рекламы». Обязанности: продажа услуг по созданию и продвижению сайтов прием входящих звонков переговоры на уровне топ-менеджмента заключение договоров, контроль внесения первого платежа, составление отчетность; Требования: знание технологии продаж; продвинутый пользователь ПК; Условия: желание зарабатывать, развиваться в сфере интернет-маркетинга и продаж пн-пт с 10:00 до 18:30 заработная плата - небольшой оклад + % с продаж Будем рады, если именно Вы станете частью нашей команды! ","продажа услуг по созданию и продвижению сайтов,прием входящих звонков,переговоры на уровне топ-менеджмента,заключение договоров, контроль внесения первого платежа, составление отчетность;",не требуется,Менеджер по продажам сайтов и интернет-рекламы,,86130.4,25000.0,полный день,,Полная занятость,https://tyumen.hh.ru/vacancy/39680108,22
171,Челябинск,Мегаполис,не указаны,14 октября 2020," Ты наш кандидат, если: владеешь основами программирования и системного администрирования; отличаешь джоб от деплоя, а UX от UI; понимаешь что такое онлайн-сервисы, как построена разработка программного обеспечения. Чем нужно будет заниматься: администрирование программно-аппаратных комплексов; обработка обратной связи от пользователей и сотрудников компании; взаимодействие с исполнителями по разработке и внедрению ИТ-сервисов; формирование списка ошибок и доработок; контроль исполнения сроков по исправлению ошибок, внесению доработок, плановой разработке; формирование справочной документации ИТ-проектам. Что получишь: коллектив, который превращает идеи в программные продукты на благо пользователей и бизнеса; прокачаешься в развитии работающих продуктов и создании новых; пятидневка, работа с 10:00 до 19:00; перспективы роста в крупной компании. ",не указано,1–3 года,Менеджер ИТ-проектов,,45000.0,45000.0,полный день,,Полная занятость,https://tyumen.hh.ru/vacancy/39504156,15
173,Челябинск,"Варяг, Холдинг предприятий безопасности",не указаны,2 октября 2020," «Варяг – технологии безопасности» – современный, стремительно развивающийся холдинг предприятий, разрабатывающих инновационные решения в области безопасности. Продуктами компании являются системы мониторинга и защиты имущества, инженерно-технические средства безопасности, услуги пультовой и физической охраны, а также образовательные услуги спецподготовки персонала. Пользователи продуктов и услуг под брендами компании - это более 25 000 клиентов на территории Уральского Федерального округа, от физических лиц и малого бизнеса до крупнейших федеральных и государственных компаний. В нынешних условиях пандемии, когда все сокращают штат и заработную плату, «Варяг» продолжает набор квалифицированных сотрудников. Открываем набор на позицию «МЕНЕДЖЕР ПО РАБОТЕ С КЛИЕНТАМИ» и предлагаем Вам стать частью нашей дружной и боевой команды! Мы предлагаем: официальное трудоустройство; стабильную заработную плата; пятидневную рабочую неделю (суббота, воскресенье – выходные); обучение внутри компании (собственный корпоративный учебный центр); личный и профессиональный рост (участие в профессиональных конференциях, семинарах); возможность карьерного роста; работу офисно-разъездного характера; оплату ГСМ и сотовой связи; скидки на услуги компании; развитую корпоративную жизнь. Что Вам предстоит делать: помогать действующим клиентам в решении любых вопросов по взаимодействию с компанией; повышать лояльность клиентов к компании (звонки и визиты вежливости, скидки, подарки, информационная поддержка и пр.); разрешать спорные ситуаций с клиентами, не допуская оттока; проводить мероприятия по снижению и предупреждению образования дебиторской задолженности. Требования к кандидату: высшее образование; опыт работы с клиентами от 1 года; грамотная устная и письменная речь; коммуникативность , доброжелательность; умение работать в режиме многозадачности; ответственность, внимательность, самостоятельность в работе; уверенный пользователь ПК. Возможно Вы – тот‚ кого мы ищем! Высылайте нам свое резюме и мы рассмотрим его в течение 3-х рабочих дней. Если Ваш опыт и пожелания соответствуют требованиям и возможностям компании - мы свяжемся с Вами по указанным в резюме контактам. ",не указано,1–3 года,Менеджер по работе с клиентами (послепродажное обслуживание),,40000.0,35000.0,полный день,"Грамотная речь,Клиентоориентированность,Деловая коммуникация,Работа с клиентами,Ориентация на клиента",Полная занятость,https://tyumen.hh.ru/vacancy/39286402,27
200,Челябинск,АТМ АЛЬЯНС,не указаны,15 октября 2020," «АТМ АЛЬЯНС» - торгово-сервисная компания , специализируется на продаже и комплексном сервисном обслуживании кассового, банковского и технологического оборудования. На протяжении 11 лет работы, компания зарекомендовала себя как надежный партнер многих крупных российских и зарубежных банков. Компания работает по направлениям: сервисное обслуживание банкоматов, ремонт и обслуживание POS-терминалов, ремонт кассового оборудования. Должностные обязанности: 1. Выполнение поставленных задач, плановых показателей, KPI 2. Активные продажи оборудования, услуг, сервиса, приложений, РКО 3. Работа с клиентской базой, входящим потоком 4. Выставление счетов, подготовка закрывающих документов (УПД, акт выполненных работ) 5. Заключение договоров поставки и на сервис 6. Контроль оплаты 7. Отгрузка оборудования 8. Отчетность, ведение CRM 9. Контроль остатков. Требования: <ol> С опытом удалённых продаж. Знание компьютера на уровне уверенного пользователя. Коммуникабельность, грамотная устная и письменная речь. Опыт консультирования и сопровождения клиентов. Ответственность, стрессоустойчивость </ol> Для комфортной деятельности Вам потребуется : 1. Персональный компьютер\ноутбук. 2. Программное обеспечение: Word, excel, PowerPoint, skype, zoom, Pdf, WhatsApp, Telegram. 3. Гарнитура 4. Мышь 5. Клавиатура 6. Интернет соединение: проводной интернет или wifi c пропускной способностью от 50 мбит/с 7. Смартфон на андроид выше 6 версии или iphone. Предоставляем: <ol> Первичное обучение в течение 7 дней. Настройку оборудования и доступа. Первичное взаимодействие с клиентом под наблюдением наставника. </ol> Условия: <ol> Своевременная оплата труда; Мотивация - % от продаж По территории: РФ График работы 5/2, с 09-18 ч. </ol> Зарплата зависит от Вашего желания зарабатывать, ограничений НЕТ! Информацию о деятельности компании вы легко можете найти в сети интернет (ищется по запросу «атм альянс»). ",не указано,1–3 года,Менеджер по продажам (home office),,86130.4,30000.0,удаленная работа,"Активные продажи,CRM,Грамотная речь,Пользователь ПК",Полная занятость,https://tyumen.hh.ru/vacancy/39530460,14
