,address,company,conditions,date,description,duty,experience,name,requirements,salaryMAX,salaryMIN,schedule,skills,type_of_employment,url,count_day
243,Чебаркуль,Группа Компаний Мечел,не указаны,1 октября 2020," Обязанности: разработка интеграций 1С:УПП с новыми системами: 1С:ERP, 1С:ЗУП, 1С:Документооборот; поддержка интеграционных механизмов с существующими внешними системами; автоматизация бизнес-процессов с использованием системы 1С; разработка нового функционала, доработка существующей конфигурации 1С:УПП; разработка ТЗ, создание рабочих инструкции, документации; работа в команде. Требования: Высшее техническое образование; Опыт работы с 1С от 3-х лет; Опыт доработки типовых конфигураций УПП; Знания платформы и средств разработки 1С:Предприятие; Знания языка запросов и СКД; Опыт разработки управляемого приложения (управляемые формы); Опыт разработки механизмов интеграции 1С с другими системами (XML, COM, Web-сервисы, Конвертация); Знания основных бизнес-процессов промышленных предприятий. Опыт и навыки в качестве дополнительных преимуществ: - Наличие сертификатов 1С:ПРОФЕССИОНАЛ: 1С:ERP, 1C:УПП, 1С:Документооборот - Наличие сертификата Наличие сертификата 1С:Специалист по платформе ""1С:Предприятие 8"" Условия: Офис по адресу Челябинская обл., г.Чебаркуль, ул.Дзержинского График работы 5/2 с 8:00 до 17:00; Соблюдение ТК РФ, официальный доход; Приглашаем Вас на собеседование после рассмотрения резюме Уровень дохода обсуждается по итогам собеседования. ",не указано,3–6 лет,Программист 1С,,,,полный день,,Полная занятость,https://tyumen.hh.ru/vacancy/39554200,28
248,Челябинск,Центр Информационных Технологий,не указаны,13 октября 2020," Мы, Центр Информационных Технологий, создаем уникальные ИТ-продукты для того, чтобы ведомства могли взаимодействовать между собой на национальном и международном уровнях. Благодаря нашим продуктам дороги становятся безопаснее, а работа почты быстрее. Заказчики доверяют нам крупные и сложные проекты, и мы полностью оправдываем их доверие. Мы на рынке с 2008 года, нас 140 и мы стремительно растем: в наших планах сначала 200 сотрудников, а что будет дальше - давайте узнаем вместе. Сейчас мы будем рады принять в свою команду Java разработчика уровня middle и выше. От нас: Офис в центре и гибкое начало рабочего дня; Демократичная атмосфера и свобода в выражении своих идей; Возможность вносить рекомендации по стеку и быть наставников для младших коллег; Забота о сотрудниках: подарки детям к новому году, выплаты к значимым датам; И конечно полностью белая з/п, плюшки и отсутствие дресс-кода. Мы ждем от кандидата: Знание Java; Опыт работы с СУБД; Умение анализировать ранее разработанный код. Знание Spring Framework, Hibernate ORM; Опыт разработки web приложений (HTML, CSS, JavaScript). Будем рады встретиться лично и обсудить варианты сотрудничества. ",не указано,3–6 лет,Java-программист middle+,,104166.7,80000.0,полный день,"Java,HTML,CSS,Spring Framework,PostgreSQL,Hibernate ORM,СУБД",Полная занятость,https://tyumen.hh.ru/vacancy/34201470,16
252,Челябинск,Avenue Media,", ,Интересные проекты,Слаженная команда,Испытательный срок 2-3 месяца (зависит от опыта),Заработная плата по итогам собеседования,Оформление по договору или как самозанятого",29 сентября 2020," Привет. Avenue Media – это диджитал продакшн с хорошим предпродакшн и качественным постпродакшн, длительным техсуппортингом и высокой клиентской экспертизой, в общем – агентство полного цикла с хорошим уровнем разработки продукта и прочими ништяками в современных трактовках :) Работаем с 2008 года, постоянно растем и инвестируем в собственные продукты. Прежде всего это обусловлено желанием сохранить качество решений и индивидуальность, которой следуем со дня основания. Наши клиенты: Мосигра, Raisio, Infotecs, AbsolutBank, Dantone Home, Global Dialog, Heli Club и другие компании. Мы разрабатываем и сопровождаем: Интернет-магазины, маркетплейсы и агрегаторы Сложные сервисы и большие бизнес-порталы Блокчейн проекты и продукты для финтеха Комплексные системы управления данными, с интеграциями, обменом, импортом и экспортом в различные сторонние сервисы Собственные программные продукты и проекты Итак... В нашу команду требуется Full Stack PHP-разработчик (пред-middle или middle). Работа 100% удаленная, на полный рабочий день, график 5/2. Основные требования: Понимать что такое ООП PHP 7+ , MySQL или MongoDB Symfony 4+, Doctrine Уметь обращаться с JavaScript и JQuery Уметь работать с пространствами имен, анонимными функциями, понимать, что такое замыкания Знать кто такой одиночка, что из себя представляет фабрика и для чего нужны адаптеры Уметь работать с базовыми вещами HTML и CSS Придерживаться принятого стиля кодирования Github (убедись, что умеешь генерить 256 ssh ключ) Условия: Полный рабочий день , удаленная командная работа (не фриланс) Интересные проекты Слаженная команда Испытательный срок 2-3 месяца (зависит от опыта) Заработная плата по итогам собеседования Оформление по договору или как самозанятого Отвечаем кандидатам с хорошо заполненным резюме и сопроводительным письмом. Пишите отклик развернуто и больше о релевантном опыте. ",не указано,1–3 года,PHP-программист,,100000.0,70000.0,полный день,"PHP,HTML,JavaScript,jQuery,HTML5,Linux,CSS3,Bootstrap,XML,ООП,Ajax,Zend Framework,Git,MongoDB,Symfony",Полная занятость,https://tyumen.hh.ru/vacancy/39526530,30
255,Челябинск,Cardsmobile,не указаны,15 октября 2020," Приложение Кошелёк - самый крупный проект по агрегации карт лояльности в России, первый независимый Pay сервис в Европе. У нас микросервисная архитектура, переходим на Java 11, любим Kotlin. Работаем с PostgreSQL и Mongo, Message Queue, Git, Maven, Elasticsearch. Работаем в небольших продуктовых командах по 3-5 человек, каждая из которых занимается развитием своего направления бизнес-логики или технической работы приложения. Какие вакансии есть сейчас: маркет-плейс (вкладка Каталог в приложении) бизнес-логика плюс рефакторинг легаси важно хорошо ориентироваться в структурах данных, коллекциях, алгоритмах, кешировании пригодится знание activiti bpmn фреймворка, чтобы его выпилить оттуда финтех (банковские карты в приложении) почти нет легаси, весь код свеженький высокие требования к безопасности, работа со спецификациями международных платежных систем работа с аутсорсом - ревью, приём кода коммуникации с пользователями (пуши) опыт профилирования узких мест, решение проблем с производительностью опыт работы с rabbitmq обязателен cardholder (основная бизнес-логика приложения) необходим опыт проектирования архитектуры, ТЗ на разработку много сложной бизнес-логики Чего ждем от вас: опыт работы с Java, Spring стеком от 2 лет понимание принципов ООП, SOLID, паттернов проектирования опыт работы с микросервисной архитектурой, понимание ее плюсов и минусов опыт работы с реляционными и noSQL базами данных аккуратный код, умение писать unit тесты и понимание, зачем это нужно Со своей стороны предлагаем: участие в развитии полезного и популярного приложения, возможность сделать мир лучше; оформление по ТК РФ с первого дня работы, конкурентную белую зарплату, ДМС; оплату мобильной связи, компенсацию оплаты питания; гибкий график, удалённая работа; возможен переезд в Санкт-Петербург для кандидатов из других городов (welcome бонус); оплату профильных курсов и конференций; командные мероприятия и приятные коллеги. ",не указано,3–6 лет,Java разработчик (удаленно),,104166.7,150000.0,удаленная работа,"Java 8,Spring Framework,MongoDB,Kotlin,Java11",Полная занятость,https://tyumen.hh.ru/vacancy/39833781,14
257,Челябинск,Группа Компаний Мечел,не указаны,1 октября 2020," Обязанности: разработка интеграций 1С:УПП с новыми системами: 1С:ERP, 1С:ЗУП, 1С:Документооборот; поддержка интеграционных механизмов с существующими внешними системами; автоматизация бизнес-процессов с использованием системы 1С; разработка нового функционала, доработка существующей конфигурации 1С:УПП; разработка ТЗ, создание рабочих инструкции, документации; работа в команде. Требования: Высшее техническое образование; Опыт работы с 1С от 3-х лет; Опыт доработки типовых конфигураций УПП; Знания платформы и средств разработки 1С:Предприятие; Знания языка запросов и СКД; Опыт разработки управляемого приложения (управляемые формы); Опыт разработки механизмов интеграции 1С с другими системами (XML, COM, Web-сервисы, Конвертация); Знания основных бизнес-процессов промышленных предприятий. Опыт и навыки в качестве дополнительных преимуществ: - Наличие сертификатов 1С:ПРОФЕССИОНАЛ: 1С:ERP, 1C:УПП, 1С:Документооборот - Наличие сертификата Наличие сертификата 1С:Специалист по платформе ""1С:Предприятие 8"" Условия: Офис по адресу Челябинская обл., г.Чебаркуль, ул.Дзержинского График работы 5/2 с 8:00 до 17:00; Соблюдение ТК РФ, официальный доход; Приглашаем Вас на собеседование после рассмотрения резюме Уровень дохода обсуждается по итогам собеседования. ",не указано,3–6 лет,Программист 1С,,104166.7,72115.5,полный день,,Полная занятость,https://tyumen.hh.ru/vacancy/39554202,28
259,Челябинск,"ЧЕТЫРЕ ЛАПЫ, Сеть зоомагазинов","Территориально: офис в г. Москва, на м. Автозаводская;,График работы: 5/2 (с 09.00/10.00 до 18.00/19.00);,ЗП высокая по итогам собеседования;,Работа в стабильной, активно развивающейся Компании;,Официальное оформление с 1 дня,Полностью белая зарплата, все выплаты на карту,Корпоративные скидки",8 октября 2020," Наша компания уже более 25 лет на страже здоровья и красоты домашних питомцев. Сеть зоомагазинов (280+ магазинов) и ветеринарных центров (5 центров), а также груминг салоны и один из самых больших интернет-магазинов по отрасли в России - все это подкреплено экспертизой, глубокими знаниями и искренней любовью к животным. На данный момент мы в поисках РНР программиста. Обеспечим компенсацию на релокацию в Москву. Работать будем над основным сайтом (интернет-магазин 4lapy.ru) и прочими проектами компании. Работа в команде, с использованием современных средств разработки – JIRA, BitBucket, Confluence. Мы находимся в процессе перехода с битрикса на кастомную микросервисную архитектуру. примерно через год планируем перейти полностью. Требования: Опыт работы: от 2-х лет; Знание PHP, mySQL; Чистый код, следование стандартам, следование принципам SOLID Опыт работы с 1С Битрикс обязательно: понимание архитектуры, написание компонентов и модулей, опыт работы с D7; Опыт работы с фреймворками - часть сайта написана с использованием Symfony; Опыт интеграции сайтов с различными сервисами по API (ОФД, онлайн-кассы, платежные системы, доставки); Наличие сертификатов 1С Битрикс приветствуется. Обязанности: Доработка текущего интернет-магазина; Исправление багов, поиск неисправностей; Тестирование; С чем придется работать: С нагруженным проектом и его распределенной IT структурой; Связкой Битрикс + Symfony + Elasticsearch; Различными интеграциями, быть готовым внедрять новое; Условия: Территориально: офис в г. Москва, на м. Автозаводская; График работы: 5/2 (с 09.00/10.00 до 18.00/19.00); ЗП высокая по итогам собеседования; Работа в стабильной, активно развивающейся Компании; Официальное оформление с 1 дня Полностью белая зарплата, все выплаты на карту Корпоративные скидки ","Доработка текущего интернет-магазина;,Исправление багов, поиск неисправностей;,Тестирование;",3–6 лет,Битрикс-программист,"Опыт работы: от 2-х лет;,Знание PHP, mySQL;,Чистый код, следование стандартам, следование принципам SOLID,Опыт работы с 1С Битрикс обязательно: понимание архитектуры, написание компонентов и модулей, опыт работы с D7;,Опыт работы с фреймворками - часть сайта написана с использованием Symfony;,Опыт интеграции сайтов с различными сервисами по API (ОФД, онлайн-кассы, платежные системы, доставки);,Наличие сертификатов 1С Битрикс приветствуется.",104166.7,72115.5,полный день,,Полная занятость,https://tyumen.hh.ru/vacancy/39701293,21
262,Челябинск,Телеофис,не указаны,22 сентября 2020," В АО ""Телеофис"" мы занимаемся разработкой и производством беспроводного оборудования для построения систем диспетчеризации, контроля и промышленной связи. За 16-ти летную историю развития мы освоили российский и зарубежные рынки, привлекли к сотрудничеству более 25 000 клиентов, заработали репутацию надежного производителя и партнера на рынке. Наша команда объединяет профессионалов из разработки, маркетинга, продаж и производства. В работе мы внедрили систему проектного управления и непрерывно продолжаем совершенствовать наше оборудование. Мы ищем в команду Java-программиста для работы с интересными проектами по разработке. Какие задачи будем решать: Разрабатывать программные алгоритмы и тесты; Проводить рефакторинг существующего кода; Разрабатывать и дорабатывать десктопное ПО (Eclipse RCP); Разрабатывать и дорабатывать web ПО (Spring, Hibernate). Мы позаботимся о твоем: Профессиональном росте и развитии – оплатим обучение, внешние курсы и тренинги; Здоровье - у нас есть ДМС со стоматологией. Также мы предлагаем: Работать удаленно из дома или в офисе в Москве; Официальное трудоустройство, полное соблюдение ТК РФ; Белую заработную плату: оклад готовы обсуждать + квартальные премии; Все необходимое лицензионное ПО для работы; Возможность получить бесценный опыт и профессионально вырасти; Удобные программы для ведения проектов: Jira, Confluence; Комфортную адаптацию и команду единомышленников; График 5/2 с возможностью гибкого начала дня с 9:00 до 10:00; Офис с видом на Нагатинскую набережную, а для твоего авто у нас есть бесплатная парковка. Ожидаем, что ты: Имеешь опыт разработки на Java SE от двух и более лет; Знаком с Spring, Hibernate, Maven; Работал с сетевыми технологиями (TCP/IP, Ethernet, GPRS); Знаешь основные алгоритмы и шаблоны проектирования ПО; Владеешь техническим английским языком; Имеешь логическое мышление и высшее образование. Будет плюсом, если ты: Владеешь технологиями Web-разработки: HTML, JavaScript, CSS, JQuery; Имеешь опыт работы с реляционными БД (MySQL, PostgreSQL); Работал с ОС Linux. Если тебя заинтересовала вакансия, направляй нам свое резюме, мы обязательно с тобой свяжемся! ",не указано,1–3 года,Java-программист,,104166.7,100000.0,удаленная работа,"Английский — B1 — Средний,Java,Spring Framework,CSS,HTML,Linux,TCP/IP",Полная занятость,https://tyumen.hh.ru/vacancy/39371981,37
