,address,company,conditions,date,description,duty,experience,name,requirements,salaryMAX,salaryMIN,schedule,skills,type_of_employment,url,count_day
424,Челябинск,ScaleLab Inc,не указаны,13 октября 2020," 100% Remote work The current website is on Magento 1.9.x, integrated with an ERP system. We’re in the process of migration to Magento 2.xx Обязанности/ Responsibilities (Magento 1.9x) - Analyze and understand business requirements, interpret them into technical solutions and be responsible for implementation from start to finish. - Analyze existing custom solutions and offer improvements - Watch logs for errors, analyze and correct issues - Study and understand M2Epro plugin which synchronizes eBay / Amazon channels. Improve existing scripts and implement new ones as business requires. Parallel Development - Migration to Magento 2.x In parallel to the current 1.9 Magento operation, work in parallel with Magento 2.x, and prepare for launch. - Create new and port old 1.9 modules in Magento 2 Responsibilities Include: - Manage existing custom plugins in the M1 / develop new solutions for the M1 - Work on the migration to the M2 with the senior developer - Work with M2Epro plugin for eBay / amazon - Odoo8 integration - analyze and offer architecture solutions for various business needs, keeping size/growth in mind - work on providing APIs for various “clients” including CRMs, martech services Требования/ Qualifications / Experience - 2 - 3 years Magento 1 experience / 1 - 2 years Magento 2 experience. - PHP 5 / 7 - Test-driven development requirement, experience on Functional Testing, Integration Testing, Unit Testing - Must be willing to work at least 4-5 hours/day overlap with US CST time zone. - A desire to be personally responsible for production-level code - Must be able to show and talk through past plugins you have developed Education - Bachelor's Degree in Computer Science or a related technical discipline, or the equivalent combination of education, professional training or work experience. Условия/ Job Advantages / How to Apply / Salary - 100% Remote work, work on your own schedule (several hours overlap with EST / CST timezone is required) About the company ScaleLab is acting as an intermediately in the job search for a US based corporation. Name is not disclosed due to privacy reasons. - An online retailer with double-digit yearly growth numbers (current at $15 million / year revenue, with a projected goal of $100 million within 5 years) - 60 + staff members and roughly 10 outside contractors on the team - In the process of growth output, with new facilities in US ",не указано,1–3 года,Middle Developer Magento (Remote work),,104166.7,2000.0,удаленная работа,"PHP,Time management,Magento",Полная занятость,https://tyumen.hh.ru/vacancy/39689879,16
425,деревня Казанцево,"Эмис, ГК",не указаны,13 октября 2020," Обязанности: Поддержание работы существующей базы 1С, доработка конфигурации, создание внешних печатных форм, обработок, отчетов. Написание инструкций, консультирование и обучение пользователей работе с программой. Требования: Законченное высшее профильное образование. Разработка в среде 1С:Предприятие 8.2-8.3 – хороший уровень. Знание основ бухгалтерского и налогового учета. Знание различных методик обмена данными. Знание конвертации данных. Знание предметных областей: RLS, управляемые блокировки. Опыт разработки управляемого приложения (управляемые формы). Хорошие знания языка запросов и СКД. Приветствуется наличие сертификатов 1С. Коммуникабельность. Ответственность. Стрессоустойчивость. Самостоятельность. Умение работать в команде. Условия: Отечественное производственное предприятие Стабильная заработная плата. Отдельные виды поощрения за инициативность. Корпоративный отдых. Дружный, молодой коллектив. Пятидневная рабочая неделя, рабочий день с 8-30ч до 17-00ч Предприятие находится в д. Казанцево, доставка служебным транспортом. Обязательно резюме по электронной почте, с указанием вакансии. ",не указано,3–6 лет,Программист 1С,,,65000.0,полный день,1С программирование,Полная занятость,https://tyumen.hh.ru/vacancy/38984784,16
426,Челябинск,Интерком-Л,не указаны,12 октября 2020," Обязанности: 1. Сопровождение модифицированной конфигурации УТ 10.3 в основном, БП. 2. Модификация существующего и разработка нового документооборота. 3. Создание отчетов на базе универсального отчета либо СКД. 4. Сопровождение собственных разработок, работа с пользователями, составление инструкций. 5. Исправление ошибок. 6. Массовая обработка данных. Требования: 1. Знание типовых конфигураций УТ, УПП в части товарного учета во всех вариациях (партии, серии, характеристики, ордера), типовой системы скидок, типовой системы прав доступа на основе профилей обязательно, прочие блоки - желательно 2. Навыки программирования в среде 1С, закрепленные практическим применением 3. Умение следовать плану работ и предоставлять отчет о деятельности 4. Умение завершать проекты «под ключ» 5. Понимание принципов построения и работы систем управления складом (WMS). 6. Умение четко формулировать задачи и решения. Условия: ​​​​​​​ 1 Официальное трудоустройство, полный соц.пакет. 2. Своевременная заработная плата без задержек. 3. График работы 5/2. с 9-00 до 18-00., выходной – суббота, воскресенье. Две субботы в месяц рабочие возможно удаленно. 4. Место работы: г. Челябинск, ул.Блюхера, 101 (Район АМЗ). ",не указано,3–6 лет,Ведущий программист,,104166.7,100000.0,полный день,"1С: Управление Торговлей,1С программирование,1С: Бухгалтерия,1С: Документооборот,1С: Розница",Полная занятость,https://tyumen.hh.ru/vacancy/38311197,17
433,Челябинск,Bell Integrator,не указаны,13 октября 2020," Bell Integrator - Компания хороших идей ! Мы создаем и внедряем ИТ-решения, которые помогают нашим клиентам эффективно ввести свой бизнес, используя продукты, улучшающие жизнь простого человека. Нашими клиентами являются ТОП 20 крупнейших финансовых организаций (Сбербанк, ВТБ, АльфаБанк, ГазпромБанк, Банк Открытие, Моcковская Биржа и др.); Лидеры телеком отрасли (Вымпелком, Tele2, МТС и др.); А так же такие гиганты: X5 Retail Group, Газпром Нефть и другие компании, в том числе международного уровня. В рамках наших проектов Вы сможете развить свои профессиональные навыки, используя самые современные технологии разработки, а также примете участие в разработке приложений, которыми пользуются миллионы пользователей по всей стране Сейчас мы расширяем команду мобильной разработки, и находимся в поиске iOS Developer (Middle| Senior). Проектов сразу несколько и по результатам собеседования уже будет возможность определить, где Ваш опыт будет наиболее подходящий : <ol> Разработка цифрового талона: время ожидания на экране и вызов к сотруднику, демонстрация контента во время ожидания. Распознавание клиентов на входе с помощью технологий лицевой биометрии. Выбор цели визита в мобильном приложении клиента. Отображение в мобильном банке загруженности отделения в течение дня, интеграция с новой системой управления очередью. Навигация клиента в отделении в зависимости от выбранной причины визита и т.д. Редизайн и доработка функциональности раздела ""шаблоны"" и ""автоплатежи"" : возможность создавать шаблоны для переводов на карту другого банка. Создание историй операций, управление в мобильном приложении привязанными картами к интернет-магазинам (Amazon, Aliexpress и др.). Редизайн, доработка функциональности и удобства раздела ""отделения и банкоматы банка"": Новый UI банкоматов и отделений. Добавить кнопку перемещения к текущему местоположению пользователя на карте, отображение статуса работы точек на карте, добавить фильтр по состоянию работы на сейчас. </ol> Мы используем: iOS SDK, Swift, git flow, e2e automation testing, release train, YARCH Наши пожелания к опыту: Наличие выпущенных приложений в AppStore Свободное владение iOS SDK Коммерческий опыт разработки на Swift Знание классических структур данных и алгоритмов Понимание цикла разработки ПО, гибких методологий (Scrum/Kanban) Умение писать Clean Code (SOLID, KISS, DRY, YAGNI) Будет плюсом: Опыт работы с однонаправленными архитектурами Понимание принципов AutoLayout Опыт написания UNIT тестов Опыт работы с CI/CD Умение проектировать REST API Мы предлагаем: ✅ Реализация удобства пользования сервисов, значимых как для бизнеса, так и для граждан; ✅ Возможность профессионального и карьерного роста в компании, возможность поучаствовать в разных проектах; ✅Опыт работы в распределенной команде профессионалов; ✅ Уровень заработной платы, соответствующий Вашим знаниям и пожеланиям; ✅ Работа удаленно . Для любителей работы в офисе есть локации: в офисе заказчика (Москва (метро Технопарк), Екатеринбург, Санкт-Петербург), в офисе Bell Integrator (Москва (метро Кожуховская), Пенза, Саратов, Уфа, Нижний Новгород). Не откладывай на потом, откликайся! ",не указано,3–6 лет,IOS разработчик (Swift),,104166.7,72115.5,удаленная работа,"iOS,swift",Полная занятость,https://tyumen.hh.ru/vacancy/39798987,16
440,Челябинск,УСТЭК-Челябинск,"Официальное трудоустройство;,Пятидневная рабочая неделя с 8:00 до 17:00, перерыв для отдыха и питания с 12:00 до 13:00;,Социальный пакет по ТК РФ.",15 октября 2020," Ведущий инженер-программист 1C ERP,группа сопровождения бизнес-приложений,отдел информационных технологий Требования: высшее профессиональное образование в области информационных технологий, программировании; хорошее знание платформы 1С, механизмов конфигурирования и администрирования прикладных решений: Бухгалтерия, ЗУП. 8 Корп; знание языка запросов; опыт работы от двух и более лет; наличие сертификата будет преимуществом. Обязанности: Осуществляет программное сопровождение и доработку конфигураций 1 С. Выполняет технические задания, в том числе: создание и доработка справочников, регистров, документов, отчетов, обработок. Осуществляет поиск и исправление ошибок в данных. Осуществляет настройку ручного и (или) автоматического обмена с внешними программами. Осуществляет перенос данных из других баз 1С, в том числе при обновлении учетной системы. Обеспечивает защиту информации: посредством настройки прав и ролей пользователей, контроля внешних вмешательств, контроля вывода информации. Подготавливает отчётность по реализованным работам, проектам, решениям. Принимает участие в обучении персонала компании и удаленных подразделений компании работе с существующими и вновь создаваемыми документами и отчетами. Консультирует пользователей по вопросам использования оборудования и работы с ППО. Анализирует и участвует в модернизации ППО (приложения, интерфейсы, аналитические отчёты). Осуществляет поддержку эксплуатируемых и вновь внедряемых ППО (модификация, настройки интерфейсов, выборка данных по запросу, формирование периодической отчётности), при необходимости согласовывает свои действия со структурными подразделениями Общества. Ведет документацию по вверенным системам и отвечает за соответствие актуальному состоянию. Оказывает техническую поддержку бизнес пользователям, согласно установленному графику отчетности, при необходимости. Условия: Официальное трудоустройство; Пятидневная рабочая неделя с 8:00 до 17:00, перерыв для отдыха и питания с 12:00 до 13:00; Социальный пакет по ТК РФ. ","Осуществляет программное сопровождение и доработку конфигураций 1 С.,Выполняет технические задания, в том числе: создание и доработка справочников, регистров, документов, отчетов, обработок.,Осуществляет поиск и исправление ошибок в данных.,Осуществляет настройку ручного и (или) автоматического обмена с внешними программами.,Осуществляет перенос данных из других баз 1С, в том числе при обновлении учетной системы.,Обеспечивает защиту информации: посредством настройки прав и ролей пользователей, контроля внешних вмешательств, контроля вывода информации.,Подготавливает отчётность по реализованным работам, проектам, решениям.,Принимает участие в обучении персонала компании и удаленных подразделений компании работе с существующими и вновь создаваемыми документами и отчетами. Консультирует пользователей по вопросам использования оборудования и работы с ППО.,Анализирует и участвует в модернизации ППО (приложения, интерфейсы, аналитические отчёты).,Осуществляет поддержку эксплуатируемых и вновь внедряемых ППО (модификация, настройки интерфейсов, выборка данных по запросу, формирование периодической отчётности), при необходимости согласовывает свои действия со структурными подразделениями Общества.,Ведет документацию по вверенным системам и отвечает за соответствие актуальному состоянию.,Оказывает техническую поддержку бизнес пользователям, согласно установленному графику отчетности, при необходимости.",1–3 года,"Ведущий инженер-программист 1C ERP, группа сопровождения бизнес-приложений","высшее профессиональное образование в области информационных технологий, программировании;,хорошее знание платформы 1С, механизмов конфигурирования и администрирования прикладных решений: Бухгалтерия, ЗУП. 8 Корп;,знание языка запросов;,опыт работы от двух и более лет;,наличие сертификата будет преимуществом.",104166.7,72115.5,полный день,"1С программирование,1С: Документооборот,1С: Бухгалтерия,1С: Предприятие 8,1С: Зарплата и управление персоналом,ERP",Полная занятость,https://tyumen.hh.ru/vacancy/39058166,14
450,Челябинск,Первый Сотовый,не указаны,9 октября 2020," Мы являемся крупным дилером операторов сотовой связи Tele2, МТС, Мегафон в Челябинске и Челябинской области! В нашей команде работают лучшие сотрудники. 90% руководящего состава компании – бывшие продавцы-консультанты! Мы предоставляем бесплатное обучение во время которого Вы уже получаете достойную заработную плату. 60% сотрудников пришли без опыта работы и добились отличных результатов как профессионально, так и в карьерном росте. У нас карьерный рост не только реален, но и возможен! 100% сотрудников использую корпоративную скидку на продукцию компании! И ты можешь стать частью крутой компании! Обязанности: Доработка, устранение ошибок в не типовых конфигурациях 1С: Управление торговлей 10.3, 1С Розница: Магазин бытовой техники 2.0 (очень сильно переписанных). Разработка нового функционала по техническому заданию, оптимизация кода, написание отчетов и обработок. Интеграция с внешними системами. Автоматизация бизнес процессов. Автоматизация обменов с помощью веб-сервисов. Помощь бухгалтерам с программами ЗУП 3.1, БП 3.0 Требования: Высшее техническое или экономическое образование; Опыт программирования 1С от 2 лет; Уверенное знание платформы 8.2 и 8.3. Обычные и управляемые формы. Умение разбираться в чужом коде; Глубокие знания СКД, обменов данными (КД 2.0); Опыт работы с конфигурациями ЗУП 3.1, БП 3.0, Розница 2.0, УТ 10.3.; Условия: График работы: 5/2 с 9:00 до 18:00, Сб, Вс - выходные дни; Оформление в соответствии с требованиями ТК РФ; Молодая, креативная команда, находящаяся в постоянном развитии и движении; Официальное трудоустройство (оплата отпусков и больничных листов); Выплата заработной платы два раза в месяц (аванс и расчет); Бесплатное обучение: корпоративные тренинги; Корпоративная сотовая связь; Карьерный рост - наши сотрудники растут и развиваются; Развитая корпоративная культура: корпоративные мероприятия, конкурсы с ценными призами; Бонусы – это скидки на продукцию компании; Наши сотрудники дружат не только на работе, у нас множество общих интересов, а руководители на одной волне с тобой; Новогодние подарки детям; Заработная плата обсуждается по итогам собеседования. ",не указано,1–3 года,Программист 1С,,104166.7,90000.0,полный день,"1С: Зарплата и управление персоналом,1С: Бухгалтерия,1С: Розница,Обучение и развитие,1С: Управление Торговлей",Полная занятость,https://tyumen.hh.ru/vacancy/37164889,20
