,address,company,conditions,date,description,duty,experience,name,requirements,salaryMAX,salaryMIN,schedule,skills,type_of_employment,url,count_day
593,Челябинск,Центр финансовых технологий,не указаны,7 октября 2020," Открыта вакансия в команде по разработке Автоматизированной Банковской Системы ""ЦФТ-банк"". !Внимание! вакансия с релокацией в города Новосибирск/ Омск/ Томск/Екатеринбург/ Ростов-на-дону/ Хабаровск Система состоит из нескольких модулей: кредитного, депозитного, фондового модулей, ядра. Каждый модуль - отдельная команда, состоящая из разработчиков, тестировщиков, аналитиков, которые совершенствуют систему ежедневно для наших клиентов (банки ТОП-50). Разработчик баз данных отвечает за разработку нового и модификацию существующего функционала в дистрибутивной версии системы. Что нужно делать? заниматься разработкой и отладкой программного кода на PL/SQL и PL+ (надстройка для оптимизации работы, которая компилируется в pl/sql и java); оформлять результаты работы в соответствии с требованиями регламентов дистрибутивной разработки для системы ЦФТ-Банк; участвовать в разборе проблемных ситуаций (дефекты, консультации), связанных с эксплуатацией программных систем работать в команде с аналитиками и тестировщиками Нам нужен человек с техническим в/о, который имеет опыт разработки в среде ORACLE или иных средах разработки баз данных от года либо только начинает, но готов учиться и уделять много времени тому, чтобы стать настоящим профи в БД и желательно (но не обязательно!), чтобы были опыт проектной или командной работы опыт разработки банковского ПО знания основ банковского дела и бухгалтерского учета/ в области ценных бумаг. В свою очередь, мы предлагаем официальное трудоустройство, полный социальный пакет, конкурентную заработную плату возможность профессионального развития и обучения: внутренние и внешние конференции, собственный Учебный Центр, бесплатная электронная библиотека забота о здоровье, программы ДМС и собственный медицинский кабинет корпоративные скидки от компаний-партнеров (льготное ипотечное и потребительское кредитование, скидки на перелеты рейсами S7); сейчас мы на удаленке, но скоро вернемся в наши комфортные офисы ",не указано,1–3 года,Разработчик баз данных (ЦФТ-Банк),,104166.7,72115.5,полный день,"ORACLE,SQL,Oracle Pl/SQL,ЦФТ - Банк",Полная занятость,https://tyumen.hh.ru/vacancy/38319200,22
597,Челябинск,"BEFIGHTER, Консалтинговая Группа",не указаны,21 сентября 2020," Обязанности: - Развитие систем на платформе 1С: доработка, оптимизация, исправление ошибок - Проработка архитектуры решений, обоснование выбора варианта, документирование задач - Работа по техническим заданиям от аналитиков и администраторов - Разработка и оптимизация интеграций систем между собой - Разработка технологических документов, инструкций, описаний Требования: -Уверенное владение базовыми механизмами и возможностями платформы 1С, включая: o Клиент-серверное программирование в системе; o Уверенное значние языка запросов 1С; o Механизм Web-сервисов; o Интерфейс прикладного решения 1С (такси); -Аналогичный опыт работы от полугода Условия: 8 часовой рабочий график с гибким началом дня (8.00-10.00) Работа в крупной федеральной компании Заработная плата обсуждается с успешными кандидатами ",не указано,1–3 года,Разработчик 1С,,104166.7,70000.0,полный день,"Администрирование,Точность и внимательность к деталям",Полная занятость,https://tyumen.hh.ru/vacancy/38789581,38
604,Челябинск,Промышленная группа СТРОЙСИСТЕМА,"Работа в команде профессионалов, готовых поделиться своими знаниями и научиться чему- то новому у вас; Возможность профессионального и карьерного роста!,Работа в стабильной компании, одной из лидеров своей отрасли в Уральском регионе, на рынке с 1974 года;,Оформление согласно ТК РФ;,Своевременная выплата заработной платы.",14 октября 2020," Обязанности: Выполнение работ на базе согласованного технического задания на базе 1С:ERP (разработка рабочих мест и рабочих столов для пользователей, разработка нового функционала через расширения и внешние отчеты и обработки, интеграция с мобильным приложение). Проверка и согласование документации на выполняемые разработки. Требования: Аналогичный опыт работы от 3-х лет; Опыт обновления нетиповых конфигураций на платформе 1С:Предприятие 8.3; Уметь разрабатывать алгоритмы, составлять блок-схемы и писать/модифицировать программы, используя специальный встроенный язык. Разработка групповая, через хранилища конфигураций; Знание современных сетевых и клиент-серверных технологий (потребуется написание обменов между ПП 1С (БП, ЗУП, ERP, УТ 11, УПП, КД “2, 3”); Наличие сертификатов 1С будет являться преимуществом. Условия: Работа в команде профессионалов, готовых поделиться своими знаниями и научиться чему- то новому у вас; Возможность профессионального и карьерного роста! Работа в стабильной компании, одной из лидеров своей отрасли в Уральском регионе, на рынке с 1974 года; Оформление согласно ТК РФ; Своевременная выплата заработной платы. "," , , , , , , , , , , , ",1–3 года,Программист 1С-ERP," , , , , , , , , , , , ",104166.7,100000.0,полный день,"1С: Предприятие 8,1С: Управление Производственным Предприятием,1С: Документооборот,1С: Производство,1С: Управление предприятием",Полная занятость,https://tyumen.hh.ru/vacancy/39299342,15
610,Магнитогорск,Факт,не указаны,9 октября 2020," Факт - лидер рынка веб-интеграторов. Надежный веб-интегратор Факт - работаем с крупнейшими российскими федеральными компаниями и представительствами крупных зарубежных компаний в России. Наши заказчики - такие известные бренды, как ПАО ""Туполев"", Технониколь, Русал, Гознак, Адамас, Paolo Conte, Gold 585, Интер РАО ЕЭС и другие. Профиль нашей компании - создание, сопровождение и развитие технологичных веб-систем. Мы ищем мобильных разработчиков ( Android , IOS) в г.г. Магнитогорск, Оренбург (в приоритете), готовых влиться в нашу команду и расти вместе с нами. Рассматриваем также удаленных сотрудников из других городов. Старт карьеры. Сотруднику назначаем наставника, проводим адаптацию и принимаем экзамены. Рост в компании. Сотрудники вырастают в профессиональном, карьерном, финансовом уровне. Жизнь внутри. У нас есть настольный теннис, шахматные турниры, покорение горных вершин Урала, велоквесты, Cheese quiz. Каждый месяц мы проводим whiskey-break. Бонусы сотрудникам. Кофе-машина, вкусный чай, корпоративная библиотека, бесплатное обучение английскому языку на рабочем месте, социальная карта от компании Факт с ежемесячно пополняемыми бонусами, возможность выполнять отдельные виды работ из дома, дополнительно оплачиваемые дни к ежегодному отпуску. Что делать: Разработка Android, IOS приложений на заказ Участие в полном цикле разработки ПО Что уметь: Для IOS Знание архитектуры и принципов разработки IOS приложений Уверенное знание XCode, Objective-C или Swift Английский на уровне чтения технической документации Для Android Знание архитектуры и принципов разработки Android приложений Уверенное знание Android SDK, Android Studio, Gradle, Java, Kotlin Английский на уровне чтения технической документации Что вас ждет: Высокая заработная плата, официальное трудоустройство по ТК РФ Соцпакет Прозрачная система профессионального, карьерного, финансового роста Бесплатное обучение английскому языку на рабочем месте Возможность реализовывать крупные, высоконагруженные web-проекты в большой команде Офис А класса в одних из лучших БЦ Магнитогорска, Оренбурга (интересуют кандидаты в указанных городах) Работа с использованием новейших программных продуктов и технологий Дружная команда профессионалов в четырех офисах по стране. Окончательное решение по размеру заработной платы принимается по итогам анализа вашего релевантного опыта работы в сфере мобильной разработки и на основании собеседования с техническим директором ",не указано,1–3 года,Мобильный разработчик,,100000.0,60000.0,полный день,"Английский — A2 — Элементарный,Xcode,Objective-C,iOS,Android SDK,Android Studio,Gradle,Java,Kotlin,Swift",Полная занятость,https://tyumen.hh.ru/vacancy/39733908,20
611,"Челябинская область,п. Увельский,ул. Элеваторная,д.5",КХП Злак,не указаны,12 октября 2020," Обязанности: Работа по проектированию, внедрению и сопровождению программного обеспечения производства Изучение причин отказов и нарушений в работе ПО, разработка предложений по их устранению и предупреждению, по повышению качества и надежности работы ПО Выполнение автономной и комплексной наладки алгоритмов управления исполнительными механизмами, регуляторов, защит, блокировок, пошаговых программ Требования: Высшее техническое образование по специальностям в области автоматизации Знание методов тестирования и отладки ПО Знание программ и опыт программирования (1С Предприятие) Опыт работы программистом на производстве Условия: Оформление в соответствии с законодательством РФ Своевременная выплата заработной платы Комфортно оборудованное рабочее место Доставка транспортом предприятия ",не указано,3–6 лет,Программист 1С,,,70000.0,полный день,,Полная занятость,https://tyumen.hh.ru/vacancy/37579906,17
612,Челябинск,Предприятие «Таврия»,не указаны,2 октября 2020," Обязанности: Разработка и доработка мобильного приложения 1С; Исправление ошибок программы, оптимизация; Поддержка и консультирование пользователей. Требования: Опыт программирования в 1С Мобильное приложение Опыт разработки приложений для Android, IOS (желательно) Знание конфигурации 1С УПП (желательно) Ответственность, целеустремленность, доброжелательность, работа в команде Приветствуется наличие сертификатов 1С Условия: График работы: пятидневная рабочая неделя с 09:00 до 18:00. З/п по итогам собеседования ","Разработка и доработка мобильного приложения 1С;,Исправление ошибок программы, оптимизация;,Поддержка и консультирование пользователей.",3–6 лет,Программист/ разработчик мобильного приложения 1С,"Опыт программирования в 1С Мобильное приложение,Опыт разработки приложений для Android, IOS (желательно),Знание конфигурации 1С УПП (желательно),Ответственность, целеустремленность, доброжелательность, работа в команде,Приветствуется наличие сертификатов 1С",104166.7,72115.5,полный день,"1С программирование,Консультирование,Обучение персонала,мобильное приложение",Полная занятость,https://tyumen.hh.ru/vacancy/39578708,27
615,Миасс,Extreme Developers,не указаны,9 октября 2020," Обязанности: • Разработка программного кода для мобильных игр (ios/android); • Реализация игровых механик и разработка интерфейсов, архитектуры игры; • Поддержка, оптимизация существующих и разработка новых модулей игры; • Интеграция дополнительных SDK; • Документирование кода; • Взаимодействие с командой разработчиков, PM, GD, художниками, QA. Требования: • Опыт работы в игровой индустрии и желание делать игры; • Опыт программирования на Unity от 3х лет, знание C#, принципов ООП; • Знание типичных паттернов, алгоритмов и структур данных; • Опыт разработки мобильных игр под платформы ios, android; • Опыт интеграции различных SDK в Unity (firebase, admob, etc); • Опыт работы с системами контроля версий (Git) и баг трекерами; • Умение работать в команде, опыт совместной работы с ГД, художниками, дизайнерами; • Навыки работы с UI, спрайтами, ассетами; • Умение разбираться в чужом коде, проводить рефакторинг; • Английский язык на уровне понимания технической литературы. Дополнительными преимуществами будут: • Опубликованные коммерческие игры, в которых принималось участие; • Знание систем биллинга для приложений под ОС Android и iOS; • Разработанные нативные плагины для Unity; • Опыт разработки клиент-серверных приложений; • Портфолио проектов и работ, выполненных при вашем непосредственном участии, а также ссылки на открытые репозитории с примерами вашего кода; • Опыт работы с нативными плагинами (In-Apps, PUSH notifications, аналитика, реклама, социальное взаимодействие); • Умение разрабатывать и поддерживать стабильную архитектуру. Условия работы: • Работа с дружной командой разносторонних людей; • Демократичное руководство; • Официальное трудоустройство; • Вертикальный и горизонтальный карьерный рост; • Чай, кофе, сладости, оплачиваемый обед; • Активная корпоративная жизнь; • Зарплатная вилка обсуждается индивидуально с каждым кандидатом на собеседовании. Если ты хочешь работать в дружном коллективе, тебя интересует разработка игр - добро пожаловать к нам! ",не указано,3–6 лет,Программист С# / Unity Developer (Middle),,175000.0,60000.0,полный день,,Полная занятость,https://tyumen.hh.ru/vacancy/39724346,20
618,Челябинск,741 Studios,не указаны,14 октября 2020," We are seeking an innovative Senior C++ Developer to design high-end applications for our clients. About Exadel: Since 1998 Exadel has been engineering its own software products and custom software for clients of all sizes. Headquartered in Walnut Creek, California, Exadel currently has 1000+ employees in development centers across America, Europe and Asia. The Customer is a global leader in Actionable Intelligence solutions. Today, over 10,000 organizations in more than 180 countries, including over 80 percent of the Fortune 100 companies and government agencies worldwide, use Customer’s Actionable Intelligence solutions to power their clients engagement and cyber intelligence operations. With over two decades of experience helping more than 10,000 organizations worldwide create lasting value, the Customer is a global leader in client engagement. Moreover the Customer is a leading global provider of security and intelligence data mining software. His Intelligence-Powered Security product portfolio is deployed in over 100 countries, helping government, critical infrastructure and enterprise organizations neutralize and prevent terror, crime and cyber threats. In other words you will work with a technology innovator backed by amazing people! About the Project: Project deals with Erlang's analysis Requirements: 3+ years of experience as a C++ software developer Current knowledge of C++ standards and specifications Be a math wizard and very comfortable with complex algorithm development Extensive experience in deploying software across a variety of platforms and operating systems Superb analytical and problem-solving skills Excellent collaboration and communication skills Great organizational and time management skills Nice to have: PhD degree in computer science, information systems, or similar C++ certification would be a great plus Responsibilities: Consulting with internal stakeholders to determine the scope of software development projects Collaborating with the software development team on application design and development Performing diagnostic tests and debugging procedures Optimizing software by performing maintenance, updates, and upgrades Documenting processes and maintaining software development records Keeping up to date with C++ standards and advancements in application development English level Intermediate + Advantages of working with Exadel: Attractive salary — we reward your commitment to our company Personal development — we understand that life-long learning is important and support everything that encourages a personal willingness to learn Language classes with a native speaker Flexible work schedule — a good work-life balance is the most important prerequisite for being creative and productive Friendly work environment Interesting job in an innovative company with the latest technologies Collaboration with a team full of interesting people ",не указано,3–6 лет,Senior C++ Developer,,104166.7,72115.5,полный день,"Английский — B2 — Средне-продвинутый,C++",Полная занятость,https://tyumen.hh.ru/vacancy/39807226,15
